{
  "$schema": "https://spec.actionschema.com/actionschema.json",
  "description": "This is at the core of the simplification. A flat object is a subset of JSON-Schema that doesn't allow for recursion in the JSON object, effectively allowing for easier manipulation of everything defined with these constraints. It can be used for validating data.",
  "type": "object",
  "properties": {
    "$schema": { "type": "string", "format": "uri-reference" }
  },
  "additionalProperties": {
    "anyOf": [
      {
        "type": ["boolean", "number", "null", "string"]
      },
      {
        "type": "array",
        "minLength": 1,
        "items": {
          "oneOf": [
            {
              "type": ["boolean", "number", "null", "string"]
            },
            {
              "type": "object",
              "additionalProperties": {
                "type": ["boolean", "number", "null", "string"]
              }
            }
          ]
        }
      }
    ]
  }
}
